{"schemaVersion":"0.1.0","tickId":911,"timestampUtc":"2026-04-29T12:31:40.973650800Z","gameState":"LOGGED_IN","localPlayer":{"worldX":3235,"worldY":3216,"plane":0,"animation":-1,"poseAnimation":808,"combatLevel":4},"inventory":[{"slot":0,"itemId":556,"quantity":25},{"slot":1,"itemId":841,"quantity":1},{"slot":2,"itemId":2309,"quantity":1},{"slot":3,"itemId":1511,"quantity":1},{"slot":4,"itemId":995,"quantity":640},{"slot":5,"itemId":1511,"quantity":1},{"slot":6,"itemId":-1,"quantity":0},{"slot":7,"itemId":1205,"quantity":1},{"slot":8,"itemId":558,"quantity":15},{"slot":9,"itemId":1265,"quantity":1},{"slot":10,"itemId":-1,"quantity":0},{"slot":11,"itemId":-1,"quantity":0},{"slot":12,"itemId":-1,"quantity":0},{"slot":13,"itemId":590,"quantity":1},{"slot":14,"itemId":-1,"quantity":0},{"slot":15,"itemId":-1,"quantity":0},{"slot":16,"itemId":-1,"quantity":0},{"slot":17,"itemId":-1,"quantity":0},{"slot":18,"itemId":-1,"quantity":0},{"slot":19,"itemId":-1,"quantity":0},{"slot":20,"itemId":-1,"quantity":0},{"slot":21,"itemId":-1,"quantity":0},{"slot":22,"itemId":-1,"quantity":0},{"slot":23,"itemId":-1,"quantity":0},{"slot":24,"itemId":559,"quantity":2},{"slot":25,"itemId":1351,"quantity":1},{"slot":26,"itemId":1925,"quantity":1},{"slot":27,"itemId":555,"quantity":6}],"equipment":[{"slot":0,"itemId":-1,"quantity":0},{"slot":1,"itemId":-1,"quantity":0},{"slot":2,"itemId":-1,"quantity":0},{"slot":3,"itemId":1277,"quantity":1},{"slot":4,"itemId":-1,"quantity":0},{"slot":5,"itemId":1171,"quantity":1},{"slot":6,"itemId":-1,"quantity":0},{"slot":7,"itemId":-1,"quantity":0},{"slot":8,"itemId":-1,"quantity":0},{"slot":9,"itemId":-1,"quantity":0},{"slot":10,"itemId":-1,"quantity":0},{"slot":11,"itemId":-1,"quantity":0},{"slot":12,"itemId":-1,"quantity":0},{"slot":13,"itemId":882,"quantity":25}],"skills":[{"name":"ATTACK","realLevel":3,"boostedLevel":3,"xp":264},{"name":"DEFENCE","realLevel":1,"boostedLevel":1,"xp":0},{"name":"STRENGTH","realLevel":1,"boostedLevel":1,"xp":0},{"name":"HITPOINTS","realLevel":10,"boostedLevel":10,"xp":1235},{"name":"RANGED","realLevel":1,"boostedLevel":1,"xp":12},{"name":"PRAYER","realLevel":1,"boostedLevel":1,"xp":4},{"name":"MAGIC","realLevel":1,"boostedLevel":1,"xp":9},{"name":"COOKING","realLevel":1,"boostedLevel":1,"xp":70},{"name":"WOODCUTTING","realLevel":17,"boostedLevel":17,"xp":3500},{"name":"FLETCHING","realLevel":1,"boostedLevel":1,"xp":0},{"name":"FISHING","realLevel":1,"boostedLevel":1,"xp":10},{"name":"FIREMAKING","realLevel":1,"boostedLevel":1,"xp":40},{"name":"CRAFTING","realLevel":1,"boostedLevel":1,"xp":0},{"name":"SMITHING","realLevel":1,"boostedLevel":1,"xp":18},{"name":"MINING","realLevel":1,"boostedLevel":1,"xp":35},{"name":"HERBLORE","realLevel":1,"boostedLevel":1,"xp":0},{"name":"AGILITY","realLevel":1,"boostedLevel":1,"xp":0},{"name":"THIEVING","realLevel":1,"boostedLevel":1,"xp":0},{"name":"SLAYER","realLevel":1,"boostedLevel":1,"xp":0},{"name":"FARMING","realLevel":1,"boostedLevel":1,"xp":0},{"name":"RUNECRAFT","realLevel":1,"boostedLevel":1,"xp":0},{"name":"HUNTER","realLevel":1,"boostedLevel":1,"xp":0},{"name":"CONSTRUCTION","realLevel":1,"boostedLevel":1,"xp":0},{"name":"SAILING","realLevel":1,"boostedLevel":1,"xp":0}],"npcs":[{"index":2695,"id":6816,"name":"Gee","combatLevel":0,"worldX":3220,"worldY":3221,"plane":0,"animation":-1,"poseAnimation":813,"orientation":0,"healthRatio":-1,"healthScale":-1,"dead":false},{"index":2704,"id":316,"name":"Leagues Tutor","combatLevel":0,"worldX":3226,"worldY":3215,"plane":0,"animation":-1,"poseAnimation":813,"orientation":512,"healthRatio":-1,"healthScale":-1,"dead":false},{"index":2708,"id":2854,"name":"Rat","combatLevel":1,"worldX":3229,"worldY":3223,"plane":0,"animation":-1,"poseAnimation":2703,"orientation":768,"healthRatio":-1,"healthScale":-1,"dead":false},{"index":2709,"id":311,"name":"Ironman tutor","combatLevel":0,"worldX":3228,"worldY":3228,"plane":0,"animation":-1,"poseAnimation":808,"orientation":512,"healthRatio":-1,"healthScale":-1,"dead":false},{"index":2712,"id":3106,"name":"Man","combatLevel":2,"worldX":3230,"worldY":3207,"plane":0,"animation":-1,"poseAnimation":819,"orientation":512,"healthRatio":-1,"healthScale":-1,"dead":false},{"index":2713,"id":10619,"name":"Bob","combatLevel":0,"worldX":3232,"worldY":3202,"plane":0,"animation":-1,"poseAnimation":819,"orientation":512,"healthRatio":-1,"healthScale":-1,"dead":false},{"index":2714,"id":6773,"name":"Doomsayer","combatLevel":0,"worldX":3232,"worldY":3223,"plane":0,"animation":-1,"poseAnimation":813,"orientation":1536,"healthRatio":-1,"healthScale":-1,"dead":false},{"index":2715,"id":2854,"name":"Rat","combatLevel":1,"worldX":3241,"worldY":3223,"plane":0,"animation":-1,"poseAnimation":2704,"orientation":1024,"healthRatio":-1,"healthScale":-1,"dead":false},{"index":2719,"id":3111,"name":"Woman","combatLevel":2,"worldX":3239,"worldY":3211,"plane":0,"animation":-1,"poseAnimation":808,"orientation":1024,"healthRatio":-1,"healthScale":-1,"dead":false},{"index":2720,"id":3107,"name":"Man","combatLevel":2,"worldX":3235,"worldY":3215,"plane":0,"animation":-1,"poseAnimation":819,"orientation":512,"healthRatio":-1,"healthScale":-1,"dead":false},{"index":2721,"id":921,"name":"Donie","combatLevel":0,"worldX":3238,"worldY":3219,"plane":0,"animation":-1,"poseAnimation":1205,"orientation":1792,"healthRatio":-1,"healthScale":-1,"dead":false},{"index":2724,"id":3112,"name":"Woman","combatLevel":2,"worldX":3232,"worldY":3203,"plane":0,"animation":-1,"poseAnimation":819,"orientation":512,"healthRatio":-1,"healthScale":-1,"dead":false},{"index":2726,"id":2854,"name":"Rat","combatLevel":1,"worldX":3230,"worldY":3226,"plane":0,"animation":-1,"poseAnimation":2704,"orientation":0,"healthRatio":-1,"healthScale":-1,"dead":false},{"index":2727,"id":306,"name":"Lumbridge Guide","combatLevel":0,"worldX":3238,"worldY":3220,"plane":0,"animation":-1,"poseAnimation":813,"orientation":512,"healthRatio":-1,"healthScale":-1,"dead":false},{"index":2738,"id":1838,"name":"Duck","combatLevel":1,"worldX":3242,"worldY":3229,"plane":0,"animation":-1,"poseAnimation":6817,"orientation":1792,"healthRatio":-1,"healthScale":-1,"dead":false},{"index":2744,"id":8391,"name":"Nigel","combatLevel":0,"worldX":3242,"worldY":3201,"plane":0,"animation":-1,"poseAnimation":7052,"orientation":512,"healthRatio":-1,"healthScale":-1,"dead":false},{"index":2745,"id":3223,"name":"Prayer tutor","combatLevel":0,"worldX":3242,"worldY":3214,"plane":0,"animation":-1,"poseAnimation":808,"orientation":512,"healthRatio":-1,"healthScale":-1,"dead":false},{"index":2748,"id":2812,"name":"Father Aereck","combatLevel":0,"worldX":3247,"worldY":3211,"plane":0,"animation":-1,"poseAnimation":808,"orientation":1024,"healthRatio":-1,"healthScale":-1,"dead":false},{"index":2749,"id":3113,"name":"Woman","combatLevel":2,"worldX":3247,"worldY":3210,"plane":0,"animation":-1,"poseAnimation":808,"orientation":1536,"healthRatio":-1,"healthScale":-1,"dead":false},{"index":2767,"id":1838,"name":"Duck","combatLevel":1,"worldX":3247,"worldY":3220,"plane":0,"animation":-1,"poseAnimation":6817,"orientation":1280,"healthRatio":-1,"healthScale":-1,"dead":false}],"players":[{"index":1558,"nameHash":"c30331948f7d20b95c246f8a815a8c6511db7e8e85b68cfffd377817bcf8f755","combatLevel":3,"worldX":3221,"worldY":3218,"plane":0,"animation":-1,"poseAnimation":808,"orientation":0,"healthRatio":-1,"healthScale":-1},{"index":1561,"nameHash":"e880f4fb39dfb0c632473cf774c3b628b3b0c9ecec5537c5d57f5bdb624df8f5","combatLevel":3,"worldX":3221,"worldY":3218,"plane":0,"animation":-1,"poseAnimation":808,"orientation":0,"healthRatio":-1,"healthScale":-1},{"index":1564,"nameHash":"76105636cb0f4ed10c0e7a88988e7b0e834b21ea546610afddb0ed4525d519b3","combatLevel":3,"worldX":3221,"worldY":3218,"plane":0,"animation":-1,"poseAnimation":808,"orientation":0,"healthRatio":-1,"healthScale":-1},{"index":1567,"nameHash":"9021774a574185bc1cf11b20d0fd4f84086a2480695121f2b7fe57beafe89c23","combatLevel":3,"worldX":3221,"worldY":3218,"plane":0,"animation":-1,"poseAnimation":808,"orientation":0,"healthRatio":-1,"healthScale":-1},{"index":130,"nameHash":"74aebd5f76dcd108003316246dbc3a09b712fee11a7650e852300e82d98c6e0f","combatLevel":104,"worldX":3222,"worldY":3220,"plane":0,"animation":-1,"poseAnimation":808,"orientation":0,"healthRatio":-1,"healthScale":-1},{"index":135,"nameHash":"e02674a26c4dcda521e22aa14bc2509b69d918f1af764dba7853707b7e5b5384","combatLevel":101,"worldX":3220,"worldY":3219,"plane":0,"animation":-1,"poseAnimation":808,"orientation":0,"healthRatio":-1,"healthScale":-1},{"index":2020,"nameHash":"f601ab68dace2f7fc7f3ba99c7de1636b645668a9dbedf9d7c04f56bad3e5173","combatLevel":4,"worldX":3231,"worldY":3225,"plane":0,"animation":-1,"poseAnimation":824,"orientation":0,"healthRatio":-1,"healthScale":-1}],"widgets":[{"index":0,"id":35913728,"type":0,"hidden":false,"text":"","name":"","x":0,"y":0,"width":765,"height":503,"childCount":0}],"sceneObjects":[{"kind":"GROUND_OBJECT","id":4736,"worldX":3223,"worldY":3204,"plane":0,"orientation":-1,"sceneX":39,"sceneY":36},{"kind":"GAME_OBJECT","id":1911,"worldX":3223,"worldY":3205,"plane":0,"orientation":1024,"sceneX":39,"sceneY":37},{"kind":"WALL_OBJECT","id":1911,"worldX":3223,"worldY":3206,"plane":0,"orientation":64,"sceneX":39,"sceneY":38},{"kind":"GAME_OBJECT","id":1188,"worldX":3223,"worldY":3206,"plane":0,"orientation":1024,"sceneX":39,"sceneY":38},{"kind":"GROUND_OBJECT","id":4735,"worldX":3223,"worldY":3207,"plane":0,"orientation":-1,"sceneX":39,"sceneY":39},{"kind":"GROUND_OBJECT","id":336,"worldX":3223,"worldY":3210,"plane":0,"orientation":-1,"sceneX":39,"sceneY":42},{"kind":"GROUND_OBJECT","id":336,"worldX":3223,"worldY":3211,"plane":0,"orientation":-1,"sceneX":39,"sceneY":43},{"kind":"GAME_OBJECT","id":10778,"worldX":3223,"worldY":3217,"plane":0,"orientation":512,"sceneX":39,"sceneY":49},{"kind":"GROUND_OBJECT","id":336,"worldX":3223,"worldY":3218,"plane":0,"orientation":-1,"sceneX":39,"sceneY":50},{"kind":"GAME_OBJECT","id":29715,"worldX":322